{
  "generated_at": "2026-10-05T13:30:00Z",
  "schema_version": "2.0",
  "slot": "pre_open",
  "market": {
    "as_of": "2026-10-05T13:30:00Z",
    "sentiment": "neutral",
    "sentiment_score": 0,
    "trend_vs_yesterday": "stable",
    "extreme_flag": "none",
    "key_reason_en": "Failed to collect market sentiment data",
    "key_reason_ko": "시장 전체 데이터 수집 실패",
    "confidence": "low",
    "intraday_shift": null
  },
  "symbols": []
}